{
  "id": "jarvis-command-registry",
  "pj": "PJ42.2",
  "version": "1.0.0",
  "default_unknown_command": "blocked",
  "commands": [
    {
      "command_id": "ASK_GENERAL",
      "label": "Ask General Question",
      "category": "dialogue",
      "description": "Answer a normal Commander question using reasoning, and route to live data when current facts are required.",
      "risk_level": "safe_read",
      "allowed_actor": ["commander", "founder_operator"],
      "adapter": "dialogue_brain",
      "approval_required": false,
      "evidence_required": true,
      "timeout_ms": 30000,
      "output_surface": ["jarvis_hud", "dialogue_card"],
      "rollback_note": "No state change; no rollback required.",
      "requires_live_data": false,
      "requires_source_confidence": false,
      "requires_commander_review": false
    },
    {
      "command_id": "LIVE_RESEARCH",
      "label": "Live Public Research",
      "category": "live_research",
      "description": "Search current public sources for unstable facts such as deadlines, fees, rules, jobs, news, or route changes.",
      "risk_level": "safe_read",
      "allowed_actor": ["commander", "founder_operator"],
      "adapter": "web_research_adapter",
      "approval_required": false,
      "evidence_required": true,
      "timeout_ms": 60000,
      "output_surface": ["jarvis_hud", "source_confidence_card", "evidence_drawer"],
      "rollback_note": "No state change; cite sources and confidence.",
      "requires_live_data": true,
      "requires_source_confidence": true,
      "requires_commander_review": false
    },
    {
      "command_id": "SEARCH_KINGSMEN_KNOWLEDGE",
      "label": "Search Kingsmen Knowledge",
      "category": "kingsmen_knowledge",
      "description": "Search Kingsmen doctrine, architecture, laws, pricing, workflows, and safe project memory before answering.",
      "risk_level": "safe_read",
      "allowed_actor": ["commander", "founder_operator"],
      "adapter": "kingsmen_knowledge_adapter",
      "approval_required": false,
      "evidence_required": true,
      "timeout_ms": 45000,
      "output_surface": ["jarvis_hud", "knowledge_card", "evidence_drawer"],
      "rollback_note": "No state change; answer must indicate source basis.",
      "requires_live_data": false,
      "requires_source_confidence": true,
      "requires_commander_review": false
    },
    {
      "command_id": "GITHUB_REPO_INSPECT",
      "label": "Inspect Kingsmen GitHub Repo",
      "category": "repo_inspection",
      "description": "Inspect approved GitHub repository files, issues, commits, and evidence without exposing private operational material.",
      "risk_level": "safe_read",
      "allowed_actor": ["commander", "founder_operator"],
      "adapter": "github_adapter",
      "approval_required": false,
      "evidence_required": true,
      "timeout_ms": 45000,
      "output_surface": ["jarvis_hud", "repo_card", "evidence_drawer"],
      "rollback_note": "No state change; no rollback required.",
      "requires_live_data": true,
      "requires_source_confidence": true,
      "requires_commander_review": false
    },
    {
      "command_id": "SYSTEM_STATUS",
      "label": "System Status",
      "category": "system_health",
      "description": "Check approved health endpoints and surface a Commander-readable status summary.",
      "risk_level": "safe_read",
      "allowed_actor": ["commander", "founder_operator"],
      "adapter": "system_health_adapter",
      "approval_required": false,
      "evidence_required": true,
      "timeout_ms": 30000,
      "output_surface": ["jarvis_hud", "system_health_panel"],
      "rollback_note": "No state change; no rollback required.",
      "requires_live_data": true,
      "requires_source_confidence": false,
      "requires_commander_review": false
    },
    {
      "command_id": "VALIDATE_PHASE",
      "label": "Validate Build Phase",
      "category": "validation_build",
      "description": "Run or prepare a validator for a Kingsmen phase, then return evidence and repair direction.",
      "risk_level": "approval_required",
      "allowed_actor": ["commander"],
      "adapter": "validation_adapter",
      "approval_required": true,
      "evidence_required": true,
      "timeout_ms": 120000,
      "output_surface": ["jarvis_hud", "validation_card", "evidence_drawer"],
      "rollback_note": "Validator should not mutate state; if output files are produced, route through safe file review.",
      "requires_live_data": false,
      "requires_source_confidence": false,
      "requires_commander_review": true
    },
    {
      "command_id": "RUN_WEB_BUILD",
      "label": "Run Web Build",
      "category": "validation_build",
      "description": "Run the web build check and summarize success, failure, and repair path.",
      "risk_level": "approval_required",
      "allowed_actor": ["commander"],
      "adapter": "build_adapter",
      "approval_required": true,
      "evidence_required": true,
      "timeout_ms": 180000,
      "output_surface": ["jarvis_hud", "build_card", "evidence_drawer"],
      "rollback_note": "No code changes allowed during build command; failed build must return repair notes only.",
      "requires_live_data": false,
      "requires_source_confidence": false,
      "requires_commander_review": true
    },
    {
      "command_id": "POSTGRES_READ_MODEL_SCAN",
      "label": "PostgreSQL Read Model Scan",
      "category": "database_read_model",
      "description": "Inspect approved read-only operational summaries and table-surface counts without exposing raw private records.",
      "risk_level": "safe_read",
      "allowed_actor": ["commander", "founder_operator"],
      "adapter": "postgres_read_model_adapter",
      "approval_required": false,
      "evidence_required": true,
      "timeout_ms": 45000,
      "output_surface": ["jarvis_hud", "database_summary_card"],
      "rollback_note": "Read-only operation; no rollback required.",
      "requires_live_data": true,
      "requires_source_confidence": false,
      "requires_commander_review": false
    },
    {
      "command_id": "PLAYWRIGHT_PORTAL_HEALTH",
      "label": "Playwright Portal Health Scout",
      "category": "playwright_scout",
      "description": "Scout an approved public or approved portal page for reachability, blockers, and evidence screenshots.",
      "risk_level": "approval_required",
      "allowed_actor": ["commander"],
      "adapter": "playwright_scout_adapter",
      "approval_required": true,
      "evidence_required": true,
      "timeout_ms": 120000,
      "output_surface": ["jarvis_hud", "portal_scout_card", "evidence_drawer"],
      "rollback_note": "Scout must not submit forms or bypass blockers; if blocked, generate manual fallback recommendation.",
      "requires_live_data": true,
      "requires_source_confidence": true,
      "requires_commander_review": true
    },
    {
      "command_id": "GENERATE_FOUNDER_DIGEST",
      "label": "Generate Founder Digest",
      "category": "report_generation",
      "description": "Generate a Founder-facing digest covering system health, routes, blockers, queues, finance, and next safe actions.",
      "risk_level": "safe_generate",
      "allowed_actor": ["commander", "founder_operator"],
      "adapter": "report_generation_adapter",
      "approval_required": false,
      "evidence_required": true,
      "timeout_ms": 60000,
      "output_surface": ["jarvis_hud", "digest_card", "evidence_drawer"],
      "rollback_note": "Generated digest is reviewable and does not change system state.",
      "requires_live_data": true,
      "requires_source_confidence": true,
      "requires_commander_review": false
    },
    {
      "command_id": "GENERATE_EVIDENCE_PACK",
      "label": "Generate Evidence Pack",
      "category": "report_generation",
      "description": "Generate a reviewable evidence pack from approved evidence entries and source trails.",
      "risk_level": "review_required",
      "allowed_actor": ["commander", "founder_operator"],
      "adapter": "evidence_pack_adapter",
      "approval_required": true,
      "evidence_required": true,
      "timeout_ms": 60000,
      "output_surface": ["jarvis_hud", "evidence_pack_card"],
      "rollback_note": "Evidence pack is a draft until Commander approves external use.",
      "requires_live_data": false,
      "requires_source_confidence": true,
      "requires_commander_review": true
    },
    {
      "command_id": "REQUEST_APPROVAL",
      "label": "Request Commander Approval",
      "category": "approval_flow",
      "description": "Create an approval request for a risky command, explaining risk, evidence, expected effect, and rollback path.",
      "risk_level": "review_required",
      "allowed_actor": ["commander"],
      "adapter": "approval_adapter",
      "approval_required": true,
      "evidence_required": true,
      "timeout_ms": 30000,
      "output_surface": ["jarvis_hud", "approval_modal"],
      "rollback_note": "If approval is denied, command remains blocked and no action is taken.",
      "requires_live_data": false,
      "requires_source_confidence": false,
      "requires_commander_review": true
    },
    {
      "command_id": "SEND_EXTERNAL_MESSAGE",
      "label": "Send External Message",
      "category": "blocked",
      "description": "Jarvis must not directly send messages to candidates, public users, schools, employers, funders, or partners as Jarvis.",
      "risk_level": "blocked",
      "allowed_actor": ["commander"],
      "adapter": "blocked_adapter",
      "approval_required": true,
      "evidence_required": true,
      "timeout_ms": 1000,
      "output_surface": ["jarvis_hud", "blocked_card"],
      "rollback_note": "No action permitted. Use approved communications workflow and Commander-reviewed drafts.",
      "blocked_reason": "Jarvis is Commander-only and must not act as public or candidate-facing agent.",
      "requires_live_data": false,